{
  "manifestVersion": 1,
  "generatedAtUtc": "2026-04-22T00:07:32.366349+00:00",
  "profileKey": "release63-plus",
  "sourceFile": "external_variables.txt",
  "variableCount": 672,
  "capabilities": [
    "ads.campaign_surfaces",
    "assets.dynamic_download",
    "avatar.effects",
    "avatar.figure.externalized",
    "campaigns.landing_view",
    "catalog.content.externalized",
    "games.feature_flags",
    "guides.support",
    "moderation.staff_tools",
    "quests.seasonal",
    "social.friendbar",
    "wired.content"
  ],
  "sections": {
    "content": {
      "external.figurepartlist.txt": "http://%site_path%/%site_path%/figuredata.xml",
      "external.texts.txt": "http://%site_path%/%site_path%/external_flash_texts.txt",
      "furnidata.load.url": "http://%site_path%/%site_path%/furnidata.txt",
      "image.library.badgepart.url": "http://%site_path%/%site_path%/c_images/Badgeparts/",
      "image.library.catalogue.url": "http://%site_path%/%site_path%/c_images/catalogue/",
      "image.library.playlist.url": "//habbo.hs.llnwd.net/c_images/playlist/",
      "image.library.questing.url": "http://%site_path%/%site_path%/c_images/Quests/",
      "image.library.url": "http://%site_path%/%site_path%/c_images/",
      "image.library.xmas11.calendar.url": "//habbo.hs.llnwd.net/c_images/xmas11_quest_calendar/",
      "private.image.library.url": "http://%site_path%/%site_path%/c_images/",
      "productdata.load.url": "http://%site_path%/%site_path%/productdata.txt"
    },
    "downloads": {
      "dynamic.download.name.template": "%revision%/hh_furni_xx_%typeid%.cct",
      "dynamic.download.samples.template": "%revision%/%typeid%.cct",
      "dynamic.download.url": "http://%site_path%/%site_path%/hot_furni/",
      "flash.dynamic.download.name.template": "%typeid%.swf",
      "flash.dynamic.download.samples.template": "mp3/sound_machine_sample_%typeid%.mp3",
      "flash.dynamic.download.url": "http://%site_path%/%site_path%/hot_furni/"
    },
    "room": {
      "room.dragging.always_center": "0",
      "room.enter.effect.delay": "5000",
      "room.enter.effect.duration": "2000",
      "room.enter.effect.enabled": "true",
      "room.enter.infostand.fade.start.delay": "20000",
      "room.rating.enable": "1",
      "room.report.enabled": "false",
      "room_moderation.improved.enabled": "true",
      "room_moderation.mute_all.enabled": "true",
      "roomenterad.habblet.enabled": "true"
    },
    "catalog": {
      "catalog.direct.sms.buy.allowed": "false",
      "catalog.direct.sms.buy.length.days": "5",
      "catalog.direct.vip.buy.enabled": "true",
      "catalog.direct.vip.buy.promo": "1",
      "catalog.drag_and_drop": "true",
      "catalog.furniture.animation": "true",
      "catalog.gallery.lang": "en",
      "catalog.large": "true",
      "catalog.multiple.purchase.enabled": "true",
      "catalog.new_direct_vip_buy_window": "true",
      "catalog.newgiftflow.enabled": "true",
      "catalog.pets.adjust_old": "false",
      "catalog.purchase.gift.singleclick": "true",
      "catalog.purchase.gift.singleclick.confirmation": "true",
      "catalog.vip.benefits.enabled": "true",
      "catalog.vip.buy.promo": "1,3",
      "catalog.vip.gift.promo": "1,3",
      "competition.africaDesert.catalogPage": "set_desert",
      "competition.africaJungle.catalogPage": "set_jungle",
      "competition.africaSavannah.catalogPage": "set_savannah",
      "competition.catalogPage": "set_desert",
      "competition.habboween12.catalogPage": "new_habboween",
      "competition.majesty.catalogPage": "habbolympix2012",
      "competition.starsRoomComp2.catalogPage": "habbo_stars_furni",
      "competition.vipParties1.catalogPage": "jetset",
      "competition.vipParties2.catalogPage": "jetset",
      "competition.vipParties3.catalogPage": "jetset",
      "competition.xmasRoomComp.catalogPage": "xmas_castles_2012",
      "image.library.catalogue.url": "http://%site_path%/%site_path%/c_images/catalogue/",
      "landing.view.community.catalog.target": "resolution_furni",
      "landing.view.custom.image.catalog.image.uri": "",
      "landing.view.custom.image.catalog.image.uri.ler": "${image.library.url}reception/ninja_promo_LTD.png",
      "landing.view.custom.image.catalog.promo.target": "ler",
      "landing.view.pixelremove.promo.catalogpage": "set_kuurna",
      "mysterybox.faq.url": "https://help.habbo.com/entries/22500467-mystery-box-and-advent-calendar-2012",
      "mysterybox.number.colors.enabled": "8",
      "mysterybox.received.illustration": "${image.library.url}xmas2012/box_notification.png",
      "mysterybox.received.linkurl": "https://help.habbo.com/entries/22500467-mystery-box-and-advent-calendar-2012",
      "mysterybox.tracker.active": "false",
      "recycler.number_of_slots": "5",
      "unique.limited.items.enabled": "true"
    },
    "games": {
      "friendbar.playSnowStorm.enabled": "false",
      "friendbar.playSnowStorm.friendsThreshold": "1000",
      "games.buy.x.games.enabled": "false",
      "games.buy.x.games.video.enabled": "false",
      "games.highscores.enabled": "true",
      "games.highscores.scrolling.enabled": "true",
      "games.tokens.enabled": "false",
      "vip.snowstorm.offer.length.days": "31"
    },
    "community": {
      "eventinfo.enabled": "true",
      "feed.badge_decorations.album": "Feed_Badges",
      "feed.badge_decorations.decoration_id": "001",
      "friendbar.notifications.enabled": "true",
      "friendbar.playSnowStorm.enabled": "false",
      "friendbar.playSnowStorm.friendsThreshold": "1000",
      "friendbar.requests.enabled": "true",
      "friendbar.stream.enabled": "true",
      "friendbar.stream.liking.enabled": "true",
      "friendbar.stream.pet_purchase.publish.enabled": "true",
      "friendbar.stream.status.enabled": "true",
      "friendbar.stream.user.enabled": "true",
      "landing.view.communitygoalhof.hasroomlink": "false",
      "landing.view.furniMaticCommunityGoal.widget": "communitygoal",
      "landing.view.londonOlympicsCommunityGoal.widget": "communitygoal",
      "landing.view.londonOlympicsCommunityGoalResults.conf": "spacing,20;title,landing.view.community.achieved.title.lympix;caption,landing.view.community.achieved.caption.lympix;bodytext,landing.view.community.achieved.bodytext.lympix;requestbadgebutton,landing.view.community.achieved.getbadge.lympix,REQ_LYMPIX_01,0,0,false",
      "landing.view.londonOlympicsCommunityGoalResults.layout": "bitmap.uri,${image.library.url}reception/torchBearerCommunityReward.png;bitmap.x,50;bitmap.y,80;container.height,240",
      "landing.view.londonOlympicsCommunityGoalResults.widget": "generic",
      "link.format.bots.help": "https://help.habbo.com/entries/22348793-out-now-the-incredible-bot",
      "link.format.club": "http://%predefined%/credits/habboclub",
      "link.format.collectibles": "http://%predefined%/credits/collectibles",
      "link.format.credits": "http://%predefined%/credits",
      "link.format.friendlist.pref": "http://%predefined%/profile/friendsmanagement?tab=6",
      "link.format.mail.compose": "http://%predefined%/me#mail/compose/%recipientid%/%random%/",
      "link.format.userpage": "http://%predefined%//rd/%ID%",
      "link.friendbar.stream.settings.see.more": "http://%site_path%/articles/2548-whats-new",
      "menu.avatar.enabled": "true",
      "menu.own_avatar.enabled": "1",
      "purse.widget.currency.shells.enabled": "0",
      "purse.widget.enabled": "1"
    },
    "campaigns": {
      "catalog.direct.vip.buy.promo": "1",
      "catalog.vip.buy.promo": "1,3",
      "catalog.vip.gift.promo": "1,3",
      "citizenship.vip.quest.promotion.enabled": "true",
      "citizenship.vip.tutorial.quest.campaign.name": "VIPTutorials",
      "club.membership.extend.basic.promotion.enabled": "true",
      "club.membership.extend.vip.promotion.enabled": "true",
      "competition.africaDesert.catalogPage": "set_desert",
      "competition.africaJungle.catalogPage": "set_jungle",
      "competition.africaSavannah.catalogPage": "set_savannah",
      "competition.catalogPage": "set_desert",
      "competition.currentlyActive": "africaDesert",
      "competition.habboween12.catalogPage": "new_habboween",
      "competition.majesty.catalogPage": "habbolympix2012",
      "competition.requiredFurnis": "anc_hot_sands,anc_pyramid_block,anc_trophy_sstone,track12_mini_torch08-08",
      "competition.requiredFurniture": "xmasRoomComp,xmas12_fireplace,xmas12_pork,xmas12_pillar1",
      "competition.starsRoomComp2.catalogPage": "habbo_stars_furni",
      "competition.timing": "2012-12-14 12:00,xmasRoomComp;2012-12-19 11:00,",
      "competition.vipParties1.catalogPage": "jetset",
      "competition.vipParties2.catalogPage": "jetset",
      "competition.vipParties3.catalogPage": "jetset",
      "competition.xmasRoomComp.catalogPage": "xmas_castles_2012",
      "daily.quest.campaign.prefix": "horse_",
      "daily.quest.room.network.id": "4",
      "game.center.promoted_game": "",
      "landing.view.africaDesert.background_horizon.visible": "false",
      "landing.view.africaDesert.background_hotel_top.uri": "${image.library.url}reception/reception_backdrop_stretch.png",
      "landing.view.africaDesert.background_left.uri": "${image.library.url}reception/egypt4_reception_backdrop_left.png",
      "landing.view.africaDesert.background_right.uri": "${image.library.url}reception/egypt_reception_backdrop_left_001.png",
      "landing.view.africaDesertFurniPromo.conf": "caption,landing.view.africaDesert.catalogpromo.caption;bodytext,landing.view.africaDesert.catalogpromo.bodytext;spacing,10;image,reception/egypt_furni_promo.png,0;catalogbutton,landing.view.africaDesert.catalogpromo.button,set_desert",
      "landing.view.africaDesertFurniPromo.layout": "container.height,300",
      "landing.view.africaDesertFurniPromo.widget": "generic",